{
  "$schema": "schema/tokens.schema.json",
  "version": "1.0.0",
  "description": "Canonical token values for Bonny Slide System. Generated outputs must not be edited by hand.",
  "foundations": {
    "font-cjk": { "type": "fontFamily", "value": "\"Noto Sans TC\",\"PingFang TC\",\"Microsoft JhengHei\",sans-serif" },
    "font-latin": { "type": "fontFamily", "value": "Arial,\"Helvetica Neue\",sans-serif" },
    "ls-cjk": { "type": "letterSpacing", "value": "0.05em" },
    "ls-latin": { "type": "letterSpacing", "value": "0" },
    "lh": { "type": "lineHeight", "value": "1.5" },
    "fs-h1": { "type": "dimension", "value": "50px" },
    "fs-metric": { "type": "dimension", "value": "56px" },
    "fs-section": { "type": "dimension", "value": "30px" },
    "fs-eyebrow": { "type": "dimension", "value": "22px" },
    "fs-q": { "type": "dimension", "value": "20px" },
    "fs-pill": { "type": "dimension", "value": "18px" },
    "fs-body": { "type": "dimension", "value": "17px" },
    "fs-caption": { "type": "dimension", "value": "14px" },
    "s0": { "type": "dimension", "value": "4px" },
    "s1": { "type": "dimension", "value": "8px" },
    "s2": { "type": "dimension", "value": "12px" },
    "s3": { "type": "dimension", "value": "16px" },
    "s4": { "type": "dimension", "value": "24px" },
    "s5": { "type": "dimension", "value": "32px" },
    "s6": { "type": "dimension", "value": "48px" },
    "s7": { "type": "dimension", "value": "64px" },
    "s8": { "type": "dimension", "value": "80px" },
    "s9": { "type": "dimension", "value": "96px" },
    "pad-y": { "type": "dimension", "value": "{s8}" },
    "pad-x": { "type": "dimension", "value": "{s9}" },
    "gutter": { "type": "dimension", "value": "{s5}" },
    "gap-section": { "type": "dimension", "value": "{s6}" },
    "pad-card": { "type": "dimension", "value": "{s6}" },
    "r-card": { "type": "dimension", "value": "24px" },
    "r-pill": { "type": "dimension", "value": "999px" },
    "r-sm": { "type": "dimension", "value": "18px" }
  },
  "themes": {
    "light": {
      "canvas": { "type": "color", "value": "#FBFBFE" },
      "backdrop": { "type": "color", "value": "#CDD2DC" },
      "surface": { "type": "color", "value": "#F1F4F9" },
      "chip": { "type": "color", "value": "#FFFFFF" },
      "ink": { "type": "color", "value": "#2B3040" },
      "muted": { "type": "color", "value": "#7C7E92" },
      "muted-soft": { "type": "color", "value": "#DCE0EB" },
      "accent": { "type": "color", "value": "#7077FB" },
      "accent-soft": { "type": "color", "value": "#E7E8FC" },
      "on-accent": { "type": "color", "value": "#FFFFFF" },
      "band-fill": { "type": "color", "value": "#2B3040" },
      "band-tag": { "type": "color", "value": "#B7BCD0" },
      "donut-3": { "type": "color", "value": "#C2C6D4" },
      "pos": { "type": "color", "value": "#2FB67A" },
      "pos-soft": { "type": "color", "value": "#DCF3E8" },
      "neg": { "type": "color", "value": "#E5556E" },
      "neg-soft": { "type": "color", "value": "#FBE2E7" },
      "warn": { "type": "color", "value": "#E08A1E" },
      "warn-soft": { "type": "color", "value": "#FBEED7" },
      "shadow-card": { "type": "shadow", "value": "0 4px 16px rgba(17,20,40,.05)" },
      "shadow-pop": { "type": "shadow", "value": "0 10px 28px rgba(17,20,40,.10)" },
      "shadow-img": { "type": "shadow", "value": "0 2px 6px rgba(17,20,40,.05), 0 16px 38px rgba(17,20,40,.13)" }
    },
    "dark": {
      "canvas": { "type": "color", "value": "#1B1B20" },
      "backdrop": { "type": "color", "value": "#111116" },
      "surface": { "type": "color", "value": "#2C2C33" },
      "chip": { "type": "color", "value": "#34343C" },
      "ink": { "type": "color", "value": "#FFFFFF" },
      "muted": { "type": "color", "value": "#9A9CA8" },
      "muted-soft": { "type": "color", "value": "#454652" },
      "accent": { "type": "color", "value": "#4D77FF" },
      "accent-soft": { "type": "color", "value": "#2A3358" },
      "on-accent": { "type": "color", "value": "#FFFFFF" },
      "band-fill": { "type": "color", "value": "#23242C" },
      "band-tag": { "type": "color", "value": "#B7BCD0" },
      "donut-3": { "type": "color", "value": "#5E6070" },
      "pos": { "type": "color", "value": "#34D399" },
      "pos-soft": { "type": "color", "value": "#173A30" },
      "neg": { "type": "color", "value": "#F26D82" },
      "neg-soft": { "type": "color", "value": "#3A1F26" },
      "warn": { "type": "color", "value": "#F2B04E" },
      "warn-soft": { "type": "color", "value": "#3A2E18" },
      "shadow-card": { "type": "shadow", "value": "0 4px 16px rgba(0,0,0,.18)" },
      "shadow-pop": { "type": "shadow", "value": "0 10px 28px rgba(0,0,0,.26)" },
      "shadow-img": { "type": "shadow", "value": "0 2px 8px rgba(0,0,0,.3), 0 20px 46px rgba(0,0,0,.5)" }
    }
  }
}
